<?xml version="1.0" encoding="UTF-8"?>
<xs:schema xmlns:xs="http://www.w3.org/2001/XMLSchema" elementFormDefault="qualified" xmlns:xsi="http://www.w3.org/2001/XMLSchema-instance">
  <xs:import namespace="http://www.w3.org/2001/XMLSchema-instance" schemaLocation="xsi.xsd"/>
  <xs:element name="catalog">
    <xs:complexType>
      <xs:sequence>
        <xs:element maxOccurs="unbounded" ref="playlist"/>
      </xs:sequence>
      <xs:attribute ref="xsi:noNamespaceSchemaLocation" use="required"/>
    </xs:complexType>
  </xs:element>
  <xs:element name="playlist">
    <xs:complexType>
      <xs:sequence>
        <xs:element ref="creator"/>
      </xs:sequence>
      <xs:attribute name="name" use="required" type="xs:NCName"/>
    </xs:complexType>
  </xs:element>
  <xs:element name="creator">
    <xs:complexType>
      <xs:sequence>
        <xs:element maxOccurs="unbounded" ref="song"/>
      </xs:sequence>
      <xs:attribute name="name" use="required" type="xs:NCName"/>
    </xs:complexType>
  </xs:element>
  <xs:element name="song">
    <xs:complexType>
      <xs:sequence>
        <xs:element ref="title"/>
        <xs:element ref="length"/>
      </xs:sequence>
    </xs:complexType>
  </xs:element>
  <xs:element name="title" type="xs:string"/>
  <xs:element name="length" type="xs:integer"/>
</xs:schema>
